{
  "schema_version": "1.0",
  "artifact_type": "pedagogical_evidence_intake",
  "kind": "teacher-review",
  "pack_path": "teacher-packs/grade-5-science/water/materials-index.yaml",
  "prepared_for_date": "2026-08-01",
  "privacy_notice": "Do not enter learner or family names, dates of birth, identifiers, contacts, addresses, recordings, health or diagnostic information, identifiable grades, or identifiable free text. Manual privacy attestation remains required.",
  "non_guarantees": [
    "Teacher review does not substitute for classroom or home trial evidence.",
    "The intake does not establish pedagogical effectiveness.",
    "The intake is not evidence until completed, normalized, validated, and explicitly registered.",
    "The privacy scanner cannot guarantee detection of every possible identifier."
  ],
  "record": {
    "schema_version": "2.0",
    "artifact_type": "teacher_review",
    "review_id": "grade-5-science-water-teacher-review-2026-08-01",
    "pack_ref": "grade-5-science-water-teacher-pack",
    "evidence_identity": {
      "commit_sha": "f6c58627a6e87fecdd5dab1a3ee141c80db03c6b",
      "content_fingerprint": {
        "algorithm": "sha256",
        "specification_version": "1.0",
        "value": "13baf6f243b48f62ada192ce91efbd87f5cb6044aab3eb6bd3404a2b8977b7fd",
        "file_count": 78
      },
      "pedagogical_snapshot": {
        "snapshot_version": "1.0",
        "taxonomy_version": "1.0",
        "selection_rules_version": "1.0",
        "selection_engine_version": "1.1",
        "lesson_dna_schema_version": "1.0",
        "activity_catalog_digest": "8e2456bcc5c35bf44f5ee0d45ea577913495026b319fb0b2564a8f0fca17f370",
        "homeschool_rules_version": "1.0",
        "homeschool_engine_version": "1.0",
        "quality_engine_version": "1.1",
        "quality_catalogue_version": "1.1",
        "quality_catalogue_digest": "7edf366fb5694c1e22c7b17514d5e5d9933379ff5e4fadc43aa32986e098246d",
        "integration_version": "1.0",
        "unit_content_identity": "bb78af3a4db7362cf09857f90f5bff28c0a81349e43f2035489a5931aae372ef",
        "lesson_dna_digests": [
          {
            "lesson_id": "grade-5-water-01-properties",
            "digest": "e7bb4c130b0946f9e38c9c2d0f8410026b71a582e5292963f2da39c2cdc75bbe"
          },
          {
            "lesson_id": "grade-5-water-02-states",
            "digest": "a256c2b7178d98f0a8306ccd86a3aae6edd5c5a608e9facabf550c019b4fb3e0"
          },
          {
            "lesson_id": "grade-5-water-03-melting-condensation",
            "digest": "3d7b312724b695b3a4aa8271362b63e0f44e537c19f5dd334c46fab713270af2"
          },
          {
            "lesson_id": "grade-5-water-04-changes-review",
            "digest": "7ba21ee546761b8cac1670d3779c7861691c47ac12b8f3bd12b6cffd12945d94"
          }
        ]
      }
    },
    "review_status": "draft",
    "reviewer": {
      "role": "primary_science_teacher",
      "subject_experience_years": null,
      "language_context": {
        "instruction_language": "ru",
        "subject_support_language": "et"
      },
      "identity_storage": "external",
      "reviewer_reference": null
    },
    "reviewed_at": "2026-08-01",
    "delivery_scopes": [],
    "review_scope": {
      "teacher_guide": false,
      "lesson_guides": [],
      "student_materials": false,
      "answer_keys": false,
      "assessment_rubric": false,
      "homeschool_materials": false,
      "safety": false,
      "language_level": false,
      "lesson_dna": false,
      "selection_and_adaptation_artifacts": false
    },
    "ratings": {
      "method_suitability_for_grade": null,
      "method_suitability_for_subject": null,
      "lesson_pattern_coherence": null,
      "timing_realism": null,
      "transition_setup_cleanup_realism": null,
      "cognitive_load": null,
      "total_productive_language_load": null,
      "russian_primary_explanation_quality": null,
      "estonian_a1_a2_support_fit": null,
      "retrieval_quality": null,
      "spaced_review_usefulness": null,
      "correction_and_self_explanation": null,
      "teacher_instruction_clarity": null,
      "classroom_feasibility": null,
      "homeschool_clarity": null,
      "parent_role_realism": null,
      "differentiation": null,
      "inclusion_accessibility": null,
      "assessment_validity": null,
      "subject_language_assessment_separation": null,
      "learner_autonomy": null,
      "motivation_competence_support": null,
      "safety": null,
      "material_availability": null,
      "artificial_repetitive_method_risk": null
    },
    "privacy": {
      "contains_student_names": false,
      "contains_birth_dates": false,
      "contains_personal_identifiers": false,
      "contains_addresses": false,
      "contains_contact_information": false,
      "contains_parent_contacts": false,
      "contains_photographs": false,
      "contains_recordings": false,
      "contains_health_data": false,
      "contains_special_category_data": false,
      "contains_identifiable_grades": false,
      "contains_identifiable_profiles": false,
      "contains_identifiable_free_text": false,
      "observations_are_aggregated": true,
      "identity_storage": "external",
      "free_text_checked_for_identifiers": false
    },
    "findings": [],
    "blocking_findings": [],
    "required_changes": [],
    "optional_improvements": [],
    "decision": {
      "status": "pending",
      "rationale": "Педагогическое ревью ещё не выполнено; шаблон не является evidence."
    }
  }
}
